Question,answer,answer,answer,answer,correct,marks,description
"If the section modulus of a beam is increased, the bending stress in the beam will",not change,increase,decrease,"Remains constant
536 A Quick Reference Book for CIVIL ENGINEERING LICENSING EXAMINATION",2,1,
"If percentage reduction in area of a certain specimen made of material ‘A’ under tensile test is 60% and
‘the percentage reduction in area of a specimen with same dimensions made of material ‘B’ is 40%, then",the material A is more ductile than material B,the material B is more ductile than material A,the ductility of material A and B is equal,the material A is brittle and material B is ductile,0,1,
"A simply supported beam ‘A’ of length l, breadth b, and depth d carries a central point load W",one-fourth,one-half,double,four times,1,1,
"A simply supported beam ‘A’ of length l, breadth b and depth d carries a central load W",one-fourth,one-half,double,four times,2,1,
"The maximum deflection of a fixed beam of length l carrying a total load W uniformly distributed
over the whole length is
wl3 wl3 wl3 wl3",,,,48EI 96EI 192EI 384EI,3,1,
The maximum deflection of a fixed beam carrying a central point load lies at,fixed ends,"centre of beam
l",from fixed ends,"none of these
3",1,1,
The point of contra flexure is a point where,shear force changes sign,bending moment changes sign,shear force is maximum,bending moment is maximum,1,1,
"When shear force at a point is zero, then bending moment is",zero,minimum,maximum,infinity,2,1,
A truss containing j joints m members will be a simple truss if,m = 2j–3,j = 2m – 3,m = 3j–2,j = 3m – 2,0,1,
"When there is a sudden increase or decrease in shear force diagram between any two points, it
indicates that there is a",point load at the two points,no loading between the two points,uniformly distributed load between the two points,uniformly varying load between the two points,0,1,
If m and m are the members of two individual simple trusses of a compound truss,m = m + m,m = m + 1,m = m + m + 2,"m = m + m + 3
1 2 2 1 2 1 2",3,1,
The forces in the members of a simple trusses may be analysed by,graphical method,method of joints,method of sections,All of above,3,1,
The section modulus of a circular section about an axis through its C,,,,"
4 16 16 32",3,1,
Which of the following statement is correct?,A continuous beam has only two supports at the ends.,A uniformly distributed load spreads uniformly over the whole length of a beam.,The bending moment is maximum where shear force is maximum.,"The maximum bending moment of a simply supported beam of length / with a central point
load W is Wl/",1,1,
A rectangular beam of length l supported at its two ends carries a central point load W,at the ends,at l/3 from both ends,at the centre,none of these,2,1,
"When a beam is Subjected to a bending moment, the strain in a layer is",equal to,directly proportional to,inversely proportional to,"independent of
Structural Mechanics",1,1,
"The bending moment at a section tends to bend or deflect the beam and the internal stresses resist its
bending",compressive stress,shear stress,bending stress,elastic modulus,2,1,
"The assumption, generally, made in the theory of simple bending is that",the beam material is perfectly homogenous and isotropic,the beam material is stressed within its elastic limit,the plane sections before bending remain plane after bending,all of the above,3,1,
"If D and d are external and internal diameters of circular shaft respectively, its polar moment of
inertia is
   ",(D4 – d4),(D4 – d4),(D4 – d4),"(D4 – d4)
2 4 64 32",3,1,
"In a simple bending of beams, the stress in the beam varies",linearly,d. parabolically,hyperbolically,elliptically,0,1,
